{
  "$schema": "https://json-schema.org/draft/2020-12/schema",
  "$id": "https://quran.ws/schema/tajweed-rules-0.4.json",
  "title": "Tajweed Rule Corpus",
  "description": "A scholar-authored corpus of tajweed rules, organised as topics > categories > ahkam > rules. Each rule carries a CASE pattern that a conforming engine compiles into a matcher over normalised Quranic text.",
  "type": "object",
  "required": ["version", "riwayah", "topics", "categories", "hukums", "rules"],
  "additionalProperties": false,
  "properties": {
    "$schema": { "type": "string" },
    "version": {
      "type": "string",
      "pattern": "^\\d+\\.\\d+\\.\\d+$",
      "description": "Semantic version of the corpus. A change in matching behaviour of any stable rule is a MAJOR bump — consumers pin this."
    },
    "riwayah": {
      "type": "string",
      "const": "hafs-an-asim",
      "description": "The riwayah these rules describe. Tajweed rulings and the underlying orthography both differ between riwayat; applying this corpus to a Warsh or Qalun text is a data error, not a configuration option."
    },
    "provenance": {
      "type": "object",
      "additionalProperties": true,
      "properties": {
        "source": { "type": "string" },
        "url": { "type": "string", "format": "uri" }
      }
    },
    "topics": {
      "type": "array",
      "items": { "$ref": "#/$defs/topic" }
    },
    "categories": {
      "type": "array",
      "items": { "$ref": "#/$defs/category" }
    },
    "hukums": {
      "type": "array",
      "items": { "$ref": "#/$defs/hukum" }
    },
    "rules": {
      "type": "array",
      "items": { "$ref": "#/$defs/rule" }
    }
  },
  "$defs": {
    "slug": {
      "type": "string",
      "pattern": "^[a-z0-9]+(-[a-z0-9]+)*$"
    },
    "label": {
      "type": "object",
      "description": "Human-readable text, keyed by BCP-47 language tag. Arabic is authoritative; other languages are translations of it.",
      "required": ["ar"],
      "additionalProperties": { "type": "string" },
      "properties": {
        "ar": { "type": "string", "minLength": 1 }
      }
    },
    "topic": {
      "type": "object",
      "required": ["id", "label"],
      "additionalProperties": false,
      "properties": {
        "id": { "$ref": "#/$defs/slug" },
        "label": { "$ref": "#/$defs/label" }
      }
    },
    "category": {
      "type": "object",
      "required": ["id", "topic", "label"],
      "additionalProperties": false,
      "properties": {
        "id": { "$ref": "#/$defs/slug" },
        "topic": { "$ref": "#/$defs/slug" },
        "label": { "$ref": "#/$defs/label" },
        "empty": {
          "type": "boolean",
          "description": "This category carries no ahkam. Kept so the hierarchy round-trips; consumers should hide it."
        }
      }
    },
    "hukum": {
      "type": "object",
      "required": ["id", "category", "label"],
      "additionalProperties": false,
      "properties": {
        "id": { "$ref": "#/$defs/slug" },
        "category": { "$ref": "#/$defs/slug" },
        "label": { "$ref": "#/$defs/label" },
        "school": {
          "type": "object",
          "description": "Where ahkam differ between scholars, each position is modelled as its own hukum rather than one being silently preferred. Consumers that want a single answer must choose a school; consumers teaching tajweed may want to show both.",
          "required": ["id", "scholar"],
          "additionalProperties": false,
          "properties": {
            "id": { "$ref": "#/$defs/slug" },
            "scholar": { "type": "string" }
          }
        }
      }
    },
    "rule": {
      "type": "object",
      "required": ["id", "hukum", "case", "scope", "status", "label"],
      "additionalProperties": false,
      "properties": {
        "id": {
          "type": "string",
          "pattern": "^[a-z0-9]+(-[a-z0-9]+)*\\.\\d+$",
          "description": "Stable public identifier, `<hukum-slug>.<n>`."
        },
        "hukum": { "$ref": "#/$defs/slug" },
        "case": {
          "type": "string",
          "minLength": 1,
          "description": "The CASE pattern: a compact Arabic notation a non-programmer can author. Space-separated alternatives inside [ ], groups joined by +, `ــ` as a wildcard, and the literal names الألف الخنجرية / واو صغيرة / ياء صغيرة for marks that are hard to type. Compiled to a regular expression by the engine — see packages/core."
        },
        "scope": {
          "enum": ["within-word", "across-words", "either"],
          "description": "Whether the groups of a multi-group CASE may span a word boundary. This also determines what may appear between groups, so there is no separate whitespace field: within-word permits no space at all, across-words requires one, either permits one.",
          "$comment": "within-word => no whitespace; across-words => \\s+; either => \\s*"
        },
        "matchAgainst": {
          "enum": ["normalized", "original"],
          "default": "normalized",
          "description": "Which text the pattern is written against. Almost every rule matches the normalised form. A rule declares `original` when it concerns a mark that normalisation removes as decoration — the maddah that identifies المد اللازم الحرفي sits over a consonant only in the disjoined letters, and is stripped before an ordinary rule could see it."
        },
        "status": {
          "enum": ["stable", "disabled"],
          "description": "`disabled` rules are published but must not be matched by default. They are kept visible rather than deleted so the gap is auditable."
        },
        "gap": {
          "enum": [
            "not-a-pattern",
            "needs-rule-composition",
            "unsupported-optional-group",
            "unsupported-token",
            "unsupported-negation",
            "unsupported-exception",
            "ambiguous-wildcard"
          ],
          "description": "For disabled rules: which limitation of the CASE notation prevents this rule from being expressed. Together these form the backlog for the next version of the notation."
        },
        "statusReason": { "type": "string" },
        "needsReview": {
          "type": "boolean",
          "description": "This rule was altered during migration, or is otherwise awaiting sign-off from a qualified reviewer. It still matches; the flag exists so the change is not invisible."
        },
        "corrections": {
          "type": "array",
          "description": "Changes made to this rule relative to the source it was migrated from, with the evidence for each.",
          "items": {
            "type": "object",
            "required": ["field", "was", "reason"],
            "additionalProperties": false,
            "properties": {
              "field": { "enum": ["case"] },
              "was": { "type": "string" },
              "reason": { "type": "string", "minLength": 1 }
            }
          }
        },
        "label": { "$ref": "#/$defs/label" },
        "notes": { "$ref": "#/$defs/label" },
        "startFrom": {
          "type": "string",
          "description": "Editorial annotation, NOT a pattern — do not compile it. Depending on the rule it marks where a highlight should visually begin (typically the first group of `case`), or gives the plain undiacritised spelling of the target word."
        }
      }
    }
  }
}
