{
  "$schema": "./schema/rules.schema.json",
  "version": "0.4.2",
  "riwayah": "hafs-an-asim",
  "provenance": {
    "source": "tajweed.quranpedia.net",
    "url": "https://tajweed.quranpedia.net"
  },
  "topics": [
    {
      "id": "tafkheem-tarqeeq",
      "label": {
        "ar": "التفخيم والترقيق"
      }
    },
    {
      "id": "letter-relations",
      "label": {
        "ar": "علاقات الحروف"
      }
    },
    {
      "id": "noon-tanween",
      "label": {
        "ar": "النون والتنوين"
      }
    },
    {
      "id": "meem-sakinah",
      "label": {
        "ar": "الميم الساكنة"
      }
    },
    {
      "id": "mushaddadatan",
      "label": {
        "ar": "المشددتان"
      }
    },
    {
      "id": "madd",
      "label": {
        "ar": "المد"
      }
    },
    {
      "id": "qalqalah",
      "label": {
        "ar": "القلقلة"
      }
    },
    {
      "id": "waqf",
      "label": {
        "ar": "أحكام الوقف"
      }
    }
  ],
  "categories": [
    {
      "id": "tafkheem-ranks",
      "topic": "tafkheem-tarqeeq",
      "label": {
        "ar": "مراتب التفخيم"
      }
    },
    {
      "id": "always-tarqeeq-letters",
      "topic": "tafkheem-tarqeeq",
      "label": {
        "ar": "الحروف المرققة"
      }
    },
    {
      "id": "ikhfa-ghunnah-quality",
      "topic": "tafkheem-tarqeeq",
      "label": {
        "ar": "ترقيق وتفخيم غنة الإخفاء الحقيقي"
      }
    },
    {
      "id": "lam-jalalah",
      "topic": "tafkheem-tarqeeq",
      "label": {
        "ar": "ترقيق وتفخيم لام لفظ الجلالة"
      }
    },
    {
      "id": "raa-rules",
      "topic": "tafkheem-tarqeeq",
      "label": {
        "ar": "أحكام الراء"
      }
    },
    {
      "id": "alef-quality",
      "topic": "tafkheem-tarqeeq",
      "label": {
        "ar": "ترقيق وتفخيم الألف"
      }
    },
    {
      "id": "mutamathilain-sagheer",
      "topic": "letter-relations",
      "label": {
        "ar": "المتماثلين الصغير"
      }
    },
    {
      "id": "letter-relations-misc",
      "topic": "letter-relations",
      "label": {
        "ar": "علاقات الحروف"
      },
      "empty": true
    },
    {
      "id": "mutajanisain-sagheer",
      "topic": "letter-relations",
      "label": {
        "ar": "المتجانسين الصغير"
      }
    },
    {
      "id": "izhar-halqi",
      "topic": "noon-tanween",
      "label": {
        "ar": "الإظهار الحلقي"
      }
    },
    {
      "id": "idgham-bi-ghunnah",
      "topic": "noon-tanween",
      "label": {
        "ar": "الإدغام بغنة"
      }
    },
    {
      "id": "idgham-bila-ghunnah",
      "topic": "noon-tanween",
      "label": {
        "ar": "الإدغام بغير غنة"
      }
    },
    {
      "id": "idgham-kamil",
      "topic": "noon-tanween",
      "label": {
        "ar": "الإدغام الكامل"
      }
    },
    {
      "id": "idgham-naqis",
      "topic": "noon-tanween",
      "label": {
        "ar": "الإدغام الناقص"
      }
    },
    {
      "id": "iqlab",
      "topic": "noon-tanween",
      "label": {
        "ar": "الإقلاب أو القلب"
      }
    },
    {
      "id": "ikhfa-haqiqi",
      "topic": "noon-tanween",
      "label": {
        "ar": "الإخفاء الحقيقي"
      }
    },
    {
      "id": "izhar-mutlaq",
      "topic": "noon-tanween",
      "label": {
        "ar": "الإظهار المطلق"
      }
    },
    {
      "id": "izhar-mutlaq-annexed",
      "topic": "noon-tanween",
      "label": {
        "ar": "محلق بالإظهار المطلق"
      },
      "empty": true
    },
    {
      "id": "idgham-shafawi",
      "topic": "meem-sakinah",
      "label": {
        "ar": "الإدغام الشفوي"
      }
    },
    {
      "id": "ikhfa-shafawi",
      "topic": "meem-sakinah",
      "label": {
        "ar": "الإخفاء الشفوي"
      }
    },
    {
      "id": "izhar-shafawi",
      "topic": "meem-sakinah",
      "label": {
        "ar": "الإظهار الشفوي"
      }
    },
    {
      "id": "mushaddadatan",
      "topic": "mushaddadatan",
      "label": {
        "ar": "المشددتان"
      }
    },
    {
      "id": "madd-tabee",
      "topic": "madd",
      "label": {
        "ar": "المدالطبيعي"
      }
    },
    {
      "id": "leen-letters",
      "topic": "madd",
      "label": {
        "ar": "حروف اللين"
      }
    },
    {
      "id": "madd-far-hamz",
      "topic": "madd",
      "label": {
        "ar": "المد الفرعي بسبب الهمز"
      }
    },
    {
      "id": "qalqalah-ranks",
      "topic": "qalqalah",
      "label": {
        "ar": "مراتب القلقلة"
      }
    },
    {
      "id": "madd-lazim",
      "topic": "madd",
      "label": {
        "ar": "المد اللازم"
      }
    },
    {
      "id": "ishmam-waqf",
      "topic": "waqf",
      "label": {
        "ar": "الإشمام عند الوقف"
      }
    }
  ],
  "hukums": [
    {
      "id": "tafkheem-rank-1-jazari",
      "category": "tafkheem-ranks",
      "label": {
        "ar": "مرتبة التفخيم الأولى (ابن الجزري)"
      },
      "school": {
        "id": "ibn-al-jazari",
        "scholar": "ابن الجزري"
      }
    },
    {
      "id": "tafkheem-rank-2-jazari",
      "category": "tafkheem-ranks",
      "label": {
        "ar": "مرتبة التفخيم الثانية (ابن الجزري)"
      },
      "school": {
        "id": "ibn-al-jazari",
        "scholar": "ابن الجزري"
      }
    },
    {
      "id": "tafkheem-rank-3-jazari",
      "category": "tafkheem-ranks",
      "label": {
        "ar": "مرتبة التفخيم الثالثة (ابن الجزري)"
      },
      "school": {
        "id": "ibn-al-jazari",
        "scholar": "ابن الجزري"
      }
    },
    {
      "id": "tafkheem-rank-4-jazari",
      "category": "tafkheem-ranks",
      "label": {
        "ar": "مرتبة التفخيم الرابعة (ابن الجزري)"
      },
      "school": {
        "id": "ibn-al-jazari",
        "scholar": "ابن الجزري"
      }
    },
    {
      "id": "tafkheem-rank-5-relative-jazari",
      "category": "tafkheem-ranks",
      "label": {
        "ar": "مرتبة التفخيم الخامسة - التفخيم النسبي (ابن الجزري)"
      },
      "school": {
        "id": "ibn-al-jazari",
        "scholar": "ابن الجزري"
      }
    },
    {
      "id": "tafkheem-rank-1-tahhan",
      "category": "tafkheem-ranks",
      "label": {
        "ar": "مرتبة التفخيم الأولى (ابن الطحان الأندلسي)"
      },
      "school": {
        "id": "ibn-al-tahhan",
        "scholar": "ابن الطحان الأندلسي"
      }
    },
    {
      "id": "tafkheem-rank-2-tahhan",
      "category": "tafkheem-ranks",
      "label": {
        "ar": "مرتبة التفخيم الثانية (ابن الطحان الأندلسي)"
      },
      "school": {
        "id": "ibn-al-tahhan",
        "scholar": "ابن الطحان الأندلسي"
      }
    },
    {
      "id": "tafkheem-rank-3-relative-tahhan",
      "category": "tafkheem-ranks",
      "label": {
        "ar": "مرتبة التفخيم الثالثة -التفخيم النسبي (ابن الطحان الأندلسي)"
      },
      "school": {
        "id": "ibn-al-tahhan",
        "scholar": "ابن الطحان الأندلسي"
      }
    },
    {
      "id": "always-tarqeeq",
      "category": "always-tarqeeq-letters",
      "label": {
        "ar": "الحروف المرققة دائما"
      }
    },
    {
      "id": "ikhfa-ghunnah-tarqeeq",
      "category": "ikhfa-ghunnah-quality",
      "label": {
        "ar": "غنة الإخفاء الحقيقي المرققة"
      }
    },
    {
      "id": "ikhfa-ghunnah-tafkheem",
      "category": "ikhfa-ghunnah-quality",
      "label": {
        "ar": "غنة الإخفاء الحقيقي المفخمة"
      }
    },
    {
      "id": "lam-jalalah-tafkheem",
      "category": "lam-jalalah",
      "label": {
        "ar": "لام لفظ الجلالة المفخمة"
      }
    },
    {
      "id": "lam-jalalah-tarqeeq",
      "category": "lam-jalalah",
      "label": {
        "ar": "لام لفظ الجلالة المرققة"
      }
    },
    {
      "id": "raa-tafkheem",
      "category": "raa-rules",
      "label": {
        "ar": "تفخيم الراء"
      }
    },
    {
      "id": "raa-tarqeeq",
      "category": "raa-rules",
      "label": {
        "ar": "ترقيق الراء"
      }
    },
    {
      "id": "raa-either-permissible",
      "category": "raa-rules",
      "label": {
        "ar": "جواز ترقيق وتفخيم الراء"
      }
    },
    {
      "id": "alef-tafkheem",
      "category": "alef-quality",
      "label": {
        "ar": "الألف المفخمة"
      }
    },
    {
      "id": "alef-tarqeeq",
      "category": "alef-quality",
      "label": {
        "ar": "الألف المرققة"
      }
    },
    {
      "id": "mutamathilain-idgham-kamil",
      "category": "mutamathilain-sagheer",
      "label": {
        "ar": "الإدغام الكامل"
      }
    },
    {
      "id": "mutamathilain-izhar",
      "category": "mutamathilain-sagheer",
      "label": {
        "ar": "الإظهار"
      }
    },
    {
      "id": "mutajanisain-idgham-naqis",
      "category": "mutajanisain-sagheer",
      "label": {
        "ar": "الإدغام الناقص"
      }
    },
    {
      "id": "mutajanisain-ikhfa-shafawi",
      "category": "mutajanisain-sagheer",
      "label": {
        "ar": "الاخفاء الشفوي"
      }
    },
    {
      "id": "izhar-halqi-noon",
      "category": "izhar-halqi",
      "label": {
        "ar": "إظهار النون"
      }
    },
    {
      "id": "izhar-halqi-tanween",
      "category": "izhar-halqi",
      "label": {
        "ar": "إظهار التنوين"
      }
    },
    {
      "id": "idgham-bi-ghunnah-noon",
      "category": "idgham-bi-ghunnah",
      "label": {
        "ar": "إدغام النون بغنة"
      }
    },
    {
      "id": "idgham-bi-ghunnah-tanween",
      "category": "idgham-bi-ghunnah",
      "label": {
        "ar": "إدغام التنوين بغنة"
      }
    },
    {
      "id": "idgham-bila-ghunnah-noon",
      "category": "idgham-bila-ghunnah",
      "label": {
        "ar": "إدغام النون بغير غنة"
      }
    },
    {
      "id": "idgham-bila-ghunnah-tanween",
      "category": "idgham-bila-ghunnah",
      "label": {
        "ar": "إدغام التنوين بغير غنة"
      }
    },
    {
      "id": "idgham-kamil-noon",
      "category": "idgham-kamil",
      "label": {
        "ar": "إدغام النون الكامل"
      }
    },
    {
      "id": "idgham-kamil-tanween",
      "category": "idgham-kamil",
      "label": {